{
  "$ref": "#/definitions/action-cards",
  "definitions": {
    "action-cards": {
      "type": "object",
      "properties": {
        "id": {
          "type": "number"
        },
        "title": {
          "type": "string"
        },
        "type": {
          "type": "string"
        },
        "effect": {
          "type": "string"
        },
        "flavor": {
          "type": "string"
        },
        "imageUrl": {
          "type": "string"
        },
        "rarity": {
          "type": "string"
        },
        "inspiredBy": {
          "type": "string",
          "format": "uri"
        },
        "$schema": {
          "type": "string"
        }
      },
      "required": [
        "id",
        "title",
        "type",
        "effect",
        "flavor",
        "imageUrl",
        "rarity"
      ],
      "additionalProperties": false
    }
  },
  "$schema": "http://json-schema.org/draft-07/schema#"
}