{
  "id": 35,
  "title": "Creator Depression",
  "type": "Action",
  "effect": "Target card's attack power is reduced by 50% this turn, 25% next turn, and 10% the turn after. Then the effect ends. Triggered by sudden demonetization with no reason given and no reply from appeal.",
  "flavor": "No strikes. No warnings. Just vibes and silence.",
  "imageUrl": "/action-cards/creator-depression.png",
  "rarity": "Rare",
  "inspiredBy": "https://x.com/karatademada/status/1936828458102849869"
}
