{
  "id": 15,
  "title": "GOONING TIME",
  "type": "Action",
  "effect": "Skip your next attack phase due to excessive distraction. Recover 5 HP.",
  "flavor": "The timeline is dangerous tonight.",
  "imageUrl": "/action-cards/gooning-time.png",
  "rarity": "Common",
  "inspiredBy": "https://x.com/bussypounder999/status/1936935808327434691"
}