{
  "id": 11,
  "title": "Spam Filtered",
  "type": "Action",
  "effect": "Negate an attack or action that failed to go through.",
  "flavor": "No notifications received.",
  "imageUrl": "/action-cards/spam-filtered.png",
  "rarity": "Common",
  "inspiredBy": "https://x.com/CC_CHRXVTIAN/status/1937019337120141499"
}