{
  "id": 7,
  "title": "Face Dox Fail",
  "type": "Action",
  "effect": "No effect. Just awkward silence.",
  "flavor": "This is who you were arguing with.",
  "imageUrl": "/action-cards/face-dox-fail.png",
  "rarity": "Common",
  "inspiredBy": "https://x.com/therealmck3nzie/status/1915205910076559508"
}