{
  "id": 28,
  "title": "I still think about this",
  "type": "Action",
  "effect": "The next time you attack with the same card, add +20 damage. This effect can only be used once per card per game.",
  "flavor": "Some tweets never leave your mind. Neither do their consequences.",
  "imageUrl": "/action-cards/i-still-think-about-this.png",
  "rarity": "Common"
}